{
  "schema_version": "SER02-EXPLAINABILITY-REQUEST-1",
  "profile": "LINEAR_REGRESSION_SYNTHETIC_V1",
  "synthetic": true,
  "requested_effect": "NONE",
  "model": {
    "model_id": "synthetic-linear-1",
    "model_type": "linear",
    "task": "regression",
    "estimator": "sklearn.LinearRegression",
    "intercept": 3,
    "coefficients": [
      2,
      -1
    ]
  },
  "feature_names": [
    "x1",
    "x2"
  ],
  "row_ids": [
    "r1",
    "r2"
  ],
  "sample_ids": [
    "r2"
  ],
  "X": [
    [
      1,
      2
    ],
    [
      2,
      1
    ]
  ],
  "background": [
    [
      0,
      0
    ]
  ]
}
